{
    "$schema": "../schema/stAccessory.json",
    "meta": {
        "name": "Pants",
        "author": "BloodRain121",
        "category": "legs",
        "tags": []
    },
    "inputs": {
        "tint0": {
            "type": "color",
            "default": "FFFFFF",
            "name": "Color"
        }
    },
    "actions": [
        {
            "type": "settint",
            "tint": {
                "type": "input",
                "input": "tint0"
            },
            "layers": ["l0"]
        }
    ],
    "layers": {
        "l0": {
            "buffer": "b0",
            "enabledByDefault": true
        }
    },
    "buffers": {
        "b0": {
            "px": {
                "302872": [
                    5801, 5901, 5802, 5902, 2506, 2507, 2508, 2109, 2209, 2309,
                    2409, 2509, 2609, 2709, 4209, 4309, 2110, 2210, 2310, 2410,
                    2510, 2610, 2710, 4210, 4310, 2511, 2512, 2513, 5716, 5317,
                    5417, 5517, 5617, 5717, 5817, 5917, 5318, 5418, 5518, 5618,
                    5718, 5818, 5918, 5719, 5720, 5721, 5730, 5731
                ],
                "352118": [3122, 3125, 3134, 3137],
                "463AA5": [
                    2000, 2400, 2600, 2800, 4200, 4400, 2501, 2502, 2003, 2403,
                    2603, 2803, 4203, 4403, 1604, 1704, 1804, 1904, 2004, 2404,
                    2604, 2804, 4204, 4404, 2105, 2205, 2305, 2705, 4305, 5906,
                    5807, 6007, 5808, 6008, 5811, 6011, 5812, 6012, 5913, 2114,
                    2214, 2314, 2714, 4314, 2015, 2415, 2615, 2815, 4215, 4415,
                    5322, 5422, 5522, 5922, 4823, 4923, 5023, 5123, 5223, 5623,
                    5823, 6023, 5224, 5624, 5824, 6024, 5725, 5726, 5227, 5627,
                    5827, 6027, 5228, 5628, 5828, 6028, 5329, 5429, 5529, 5929
                ],
                "4A3DAD": [
                    2100, 2200, 2300, 2700, 4300, 2001, 2401, 2601, 2801, 4201,
                    4401, 2002, 2402, 2602, 2802, 4202, 4402, 2103, 2203, 2303,
                    2703, 4303, 2104, 2204, 2304, 2704, 4304, 5907, 5908, 5809,
                    6009, 5810, 6010, 5911, 5912, 2115, 2215, 2315, 2715, 4315,
                    5323, 5423, 5523, 5923, 5324, 5424, 5524, 5924, 5225, 5625,
                    5825, 6025, 5226, 5626, 5826, 6026, 5327, 5427, 5527, 5927,
                    5328, 5428, 5528, 5928
                ],
                "382F85": [
                    2500, 5800, 5900, 6000, 6001, 6002, 2503, 5803, 5903, 6003,
                    2504, 5804, 5904, 6004, 2505, 1607, 1707, 1807, 1907, 2007,
                    2107, 2207, 2307, 2407, 2607, 2707, 2807, 4207, 4307, 4407,
                    2008, 2108, 2208, 2308, 2408, 2608, 2708, 2808, 4208, 4308,
                    4408, 2009, 2809, 4409, 2010, 2810, 4410, 2011, 2111, 2211,
                    2311, 2411, 2611, 2711, 2811, 4211, 4311, 4411, 2012, 2112,
                    2212, 2312, 2412, 2612, 2712, 2812, 4212, 4312, 4412, 2514,
                    2515, 5815, 5915, 6015, 5216, 5316, 5416, 5516, 5616, 5816,
                    5916, 6016, 5217, 6017, 5218, 6018, 5219, 5319, 5419, 5519,
                    5619, 5819, 5919, 6019, 4820, 4920, 5020, 5120, 5220, 5320,
                    5420, 5520, 5620, 5820, 5920, 6020, 5722, 5723, 5724, 5727,
                    5728, 5729, 5231, 5331, 5431, 5531, 5631, 5831, 5931, 6031
                ],
                "4D3FB4": [
                    2101, 2201, 2301, 2701, 4301, 2102, 2202, 2302, 2702, 4302,
                    5909, 5910, 5325, 5425, 5525, 5925, 5326, 5426, 5526, 5926
                ],
                "3F3494": [
                    1605, 1705, 1805, 1905, 2005, 2405, 2605, 2805, 4205, 4405,
                    5805, 5905, 6005, 1606, 1706, 1806, 1906, 2006, 2106, 2206,
                    2306, 2406, 2606, 2706, 2806, 4206, 4306, 4406, 5806, 6006,
                    2013, 2113, 2213, 2313, 2413, 2613, 2713, 2813, 4213, 4313,
                    4413, 5813, 6013, 2014, 2414, 2614, 2814, 4214, 4414, 5814,
                    5914, 6014, 4821, 4921, 5021, 5121, 5221, 5321, 5421, 5521,
                    5621, 5821, 5921, 6021, 4822, 4922, 5022, 5122, 5222, 5622,
                    5822, 6022, 1628, 1728, 1828, 1928, 1629, 1729, 1829, 1929,
                    5229, 5629, 5829, 6029, 1630, 1730, 1830, 1930, 5230, 5330,
                    5430, 5530, 5630, 5830, 5930, 6030, 1631, 1731, 1831, 1931,
                    1632, 1732, 1832, 1932, 1633, 1733, 1833, 1933, 1634, 1734,
                    1834, 1934, 1635, 1735, 1835, 1935
                ],
                "20150F": [
                    3116, 3117, 3118, 3119, 3120, 3127, 3128, 3129, 3130, 3131,
                    3132, 3139
                ],
                "2B1B13": [3121, 3126, 3133, 3138],
                "CCCCCC": [3123],
                "B8B8B8": [3124],
                "3B251C": [3135, 3136]
            }
        }
    }
}
