{
    "$schema": "../schema/stAccessory.json",
    "meta": {
        "name": "Cat",
        "author": "",
        "category": "face",
        "tags": []
    },
    "inputs": {
        "c0": {
            "type": "color",
            "name": "Outside color",
            "default": "FFFFFF"
        },
        "c1": {
            "type": "color",
            "name": "Inside color",
            "default": "F6C7D4"
        }
    },
    "layers": {
        "l0": {
            "buffer": "b0",
            "enabledByDefault": true
        }
    },
    "buffers": {
        "b0": {
            "px": {
                "#c0": [
                    708, 709, 714, 715, 807, 808, 809, 814, 815, 816, 907, 908,
                    910, 913, 915, 916, 1007, 1008, 1015, 1016, 741, 746, 841,
                    846, 939, 940, 942, 945, 947, 948, 1039, 1040, 1047, 1048
                ],
                "#c1": [909, 914, 1009, 1014, 1041, 1046],
                "00000000": [941, 946]
            }
        }
    }
}
